{
  "version": 3,
  "contractVersion": "2.0.0",
  "task": {
    "id": "X.Y",
    "title": "Example critical task",
    "class": "critical"
  },
  "git": {
    "branch": "agent/example-critical-task",
    "baseSha": "0000000000000000000000000000000000000000",
    "requireCleanStage": true,
    "expectedTransitions": ["untracked-to-tracked"]
  },
  "scope": {
    "allowedPaths": ["src/modules/example/**", "test/example/**", "docs/**"],
    "protectedPaths": [
      "src/modules/auth/**",
      "src/database/migrations/previous/**"
    ]
  },
  "artifacts": {
    "taskPacket": ".codex/task-packets/X.Y.md"
  },
  "validation": { "surfaces": ["app", "tooling"] },
  "rehydration": {
    "directSources": [
      "AGENTS.md",
      "docs/TASK_CLASSIFICATION.md",
      "docs/DEVELOPMENT_WORKFLOW.md"
    ],
    "expansionTriggers": [
      "base drift",
      "conflicting authority",
      "protected contract impact",
      "High finding without a local cause",
      "Critical finding"
    ]
  },
  "autonomy": {
    "allowHighCorrections": true,
    "requireIndependentReverification": true
  },
  "contracts": {
    "authorityRepository": "arthurportodev/genesis-platform-api",
    "contractSet": "schemas/development-operations/contract-set.json"
  }
}
